Sheet: BOM
B2: Project : | C2: GP8B | F2: V5.0
B4: Author : Guillaume Guillet | E4: Revision 1 | F4: Licensed under CERN-OHL-W v2 or later
A6: Type | B6: Value | C6: Q | D6: References | E6: Package | F6: Manufacturer | G6: Store | H6: Store ID | I6: Unit price* | J6: Price
A7: C | B7: 10nF | C7: 35 | D7: C1 to C6, C8, C10 to C19, C21 to C23, C25, C27, C29 to C31, C34 to C38, C41 to C45 | E7: C_0805_2012Metric | F7: KEMET | G7: Mouser | H7: 80-C0805C103J5R | I7: 0.039 | J7: of:=[.I7]*[.C7] -> 1.365
B8: 100nF | C8: 8 | D8: C7, C9, C20, C24, C26, C28, C32, C39 | E8: C_0805_2012Metric | F8: KEMET | G8: Mouser | H8: 80-C0805C104K3R | I8: 0.143 | J8: of:=[.I8]*[.C8] -> 1.144
B9: 1uF | C9: 2 | D9: C33, C40 | E9: C_0805_2012Metric | F9: KEMET | G9: Mouser | H9: 80-C0805C105K3RAUTO | I9: 0.124 | J9: of:=[.I9]*[.C9] -> 0.248
A10: U | B10: 74AHC08 | C10: 2 | D10: U16,U14 | E10: SOIC-14_3.9x8.7mm_P1.27mm | F10: Texas Instruments | G10: Mouser | H10: 595-SN74AHC08QDRQ1 | I10: 0.439 | J10: of:=[.I10]*[.C10] -> 0.878
B11: 74AHC273 | C11: 9 | D11: U6, U24, U26, U27, U29, U31, U33, U35, U37 | E11: SOIC-20W_7.5x12.8mm_Pitch1.27mm | F11: Texas Instruments | G11: Mouser | H11: 595-SN74AHC273DWR | I11: 0.42 | J11: of:=[.I11]*[.C11] -> 3.78
B12: 74AHCT273 | C12: 1 | D12: U7 | E12: SOIC-20W_7.5x12.8mm_Pitch1.27mm | F12: Texas Instruments | G12: Mouser | H12: 595-SN74AHCT273DWR | I12: 0.496 | J12: of:=[.I12]*[.C12] -> 0.496
B13: 74HC163 | C13: 1 | D13: U8 | E13: SOIC-16_3.9x9.9mm_P1.27mm | F13: Texas Instruments | G13: Mouser | H13: 595-SN74HC163D | I13: 0.506 | J13: of:=[.I13]*[.C13] -> 0.506
B14: CD74AC238 | C14: 4 | D14: U9, U11, U13, U15 | E14: SOIC-16_3.9x9.9mm_P1.27mm | F14: Texas Instruments | G14: Mouser | H14: 595-CD74AC238M96 | I14: 0.572 | J14: of:=[.I14]*[.C14] -> 2.288
B15: 74AHCT244 | C15: 5 | D15: U19 à U23 | E15: SOIC-20W_7.5x12.8mm_Pitch1.27mm | F15: Texas Instruments | G15: Mouser | H15: 595-SN74AHCT244DWR | I15: 0.467 | J15: of:=[.I15]*[.C15] -> 2.335
B16: 74AHC138 | C16: 1 | D16: U17 | E16: SOIC-16W_5.3x10.2mm_P1.27mm | F16: Texas Instruments | G16: Mouser | H16: 595-SN74AHC138NSR | I16: 0.515 | J16: of:=[.I16]*[.C16] -> 0.515
B17: 74HC165 | C17: 1 | D17: U18 | E17: SOIC-16_3.9x9.9mm_P1.27mm | F17: Texas Instruments | G17: Mouser | H17: 595-SN74HC165QDRQ1 | I17: 0.544 | J17: of:=[.I17]*[.C17] -> 0.544
B18: 74LVC1G34 | C18: 1 | D18: U34 | E18: SOT-23-5 | F18: Texas Instruments | G18: Mouser | H18: 595-SN74LVC1G34DBVR | I18: 0.266 | J18: of:=[.I18]*[.C18] -> 0.266
B19: 74AHCT595 | C19: 1 | D19: U25 | E19: SOIC-16_3.9x9.9mm_P1.27mm | F19: Texas Instruments | G19: Mouser | H19: 595-SN74AHCT595DR | I19: 0.42 | J19: of:=[.I19]*[.C19] -> 0.42
B20: 74AHC05 | C20: 3 | D20: U1, U2, U5 | E20: SOIC-14_3.9x8.7mm_P1.27mm | F20: Texas Instruments | G20: Mouser | H20: 595-SN74AHC05D | I20: 0.553 | J20: of:=[.I20]*[.C20] -> 1.659
B21: 74AHC374 | C21: 1 | D21: U38 | E21: SOIC-20W_7.5x12.8mm_Pitch1.27mm | F21: Texas Instruments | G21: Mouser | H21: 595-SN74AHC374DWR | I21: 0.496 | J21: of:=[.I21]*[.C21] -> 0.496
B22: 74AHC1G04 | C22: 6 | D22: U3, U4, U10, U12, U36, U39 | E22: SOT-23-5 | F22: Texas Instruments | G22: Mouser | H22: 595-SN74AHC1G04DBVR | I22: 0.305 | J22: of:=[.I22]*[.C22] -> 1.83
B23: TPS7A0518PDBZR | C23: 1 | D23: U28 | E23: SOT-23-3 | F23: Texas Instruments | G23: Mouser | H23: 595-TPS7A0518PDBZR | I23: 0.572 | J23: of:=[.I23]*[.C23] -> 0.572
B24: SN74LVC8T245DW | C24: 1 | D24: U30 | E24: SOIC-24W_7.5x15.4mm_P1.27mm | F24: Texas Instruments | G24: Mouser | H24: 595-SN74LVC8T245DWR | I24: 0.973 | J24: of:=[.I24]*[.C24] -> 0.973
B25: SN74LVC4T245D | C25: 1 | D25: U32 | E25: SOIC-16_3.9x9.9mm_P1.27mm | F25: Texas Instruments | G25: Mouser | H25: 595-SN74AVC4T245D | I25: 1 | J25: of:=[.I25]*[.C25] -> 1
B26: XC2C256-VQ100 | C26: 1 | D26: IC1 | E26: VQFP-100_14x14mm_P0.5mm | F26: Xilinx Inc, | G26: Mouser | H26: 217-XC2C256-7VQG100C | I26: 18.41 | J26: of:=[.I26]*[.C26] -> 18.41
A27: R | B27: 470E | C27: 1 | D27: R5 | E27: R_0805_2012Metric | F27: Bourns | G27: Mouser | H27: 652-CR0805FX-4700ELF | I27: 0.095 | J27: of:=[.I27]*[.C27] -> 0.095
B28: 1k5 | C28: 1 | D28: R4 | E28: R_0805_2012Metric | F28: Bourns | G28: Mouser | H28: 652-CR0805FX-1501ELF | I28: 0.095 | J28: of:=[.I28]*[.C28] -> 0.095
B29: 10k | C29: 3 | D29: R1, R2, R3 | E29: R_0805_2012Metric | F29: Bourns | G29: Mouser | H29: 652-CR0805-JW-103ELF | I29: 0.095 | J29: of:=[.I29]*[.C29] -> 0.285
A30: RN | B30: 8x10k | C30: 2 | D30: RN1, RN2 | E30: R_Array_SIP9 | F30: Bourns | G30: Mouser | H30: 652-4609H-1LF-10K | I30: 0.572 | J30: of:=[.I30]*[.C30] -> 1.144
A31: D | B31: GREEN_2.65V_2mA | C31: 2 | D31: D1, D2 | E31: LED_1206_3216Metric | F31: Kingbright | G31: Mouser | H31: 604-APT3216LZGCK | I31: 0.42 | J31: of:=[.I31]*[.C31] -> 0.84
A32: J | B32: TE_Eurocard_96pole | C32: 1 | D32: J2 | E32: Eurocard_5650473-5 | F32: TE connectivity | G32: Mouser | H32: 571-5650473-5 | I32: 4.81 | J32: of:=[.I32]*[.C32] -> 4.81
B33: 5530843-2 | C33: 1 | D33: J3 | E33: TE_5530843-2 | F33: TE connectivity | G33: Mouser | H33: 571-5530843-2 | I33: 2.41 | J33: of:=[.I33]*[.C33] -> 2.41
B34: Conn_01x06_Male | C34: 1 | D34: J1 | E34: PinHeader_1x06_P2.54mm_Vertical | F34: TE connectivity | G34: Mouser | H34: 571-826936-6 | I34: 0.439 | J34: of:=[.I34]*[.C34] -> 0.439
B35: Conn_02x15_Male | C35: 1 | D35: J4 | E35: PinHeader_2x15_P1.27mm_Vertical | F35: Samtec | G35: Mouser | H35: 200-TMS11502GD | I35: 2.88 | J35: of:=[.I35]*[.C35] -> 2.88
B36: Conn_02x19_Male | C36: 1 | D36: J5 | E36: PinHeader_2x19_P1.27mm_Vertical | F36: Samtec | G36: Mouser | H36: 200-TMS12002GD | I36: 3.87 | J36: of:=[.I36]*[.C36] -> 3.87
A37: - | B37: PCB_GP8B_V5.0 | C37: 1 | D37: - | E37: - | F37: G.Guillet | G37: - | J37: of:=[.I37]*[.C37] -> 0
H39: Total price : | J39: of:=SUM([.J7:.J37]) -> 56.593
H40: *Depend of the quantity | I40: Price is in CHF