Sheet: BOM
B2: Project : | C2: GP8B | F2: V6.0
B4: Author : Guillaume Guillet | E4: Revision 1 | F4: Licensed under CERN-OHL-W v2 or later
A6: Type | B6: Value | C6: Q | D6: References | E6: Package | F6: Manufacturer | G6: Store | H6: Store ID | I6: Unit price* | J6: Price
A7: C | B7: 10nF | C7: 32 | D7: C1, C2, C3, C4, C5, C6, C8, C10, C11, C12, C13, C14, C15, C16, C17, C18, C19, C21, C22, C23, C25, C27, C29, C34, C35, C37, C41, C42, C43, C44, C45, C47 | E7: C_0805_2012Metric | F7: Wurth Elektronik | G7: Mouser | H7: 710-885012207066 | I7: 0.032 | J7: of:=[.I7]*[.C7] -> 1.024
B8: 100nF | C8: 12 | D8: C7, C9, C20, C24, C26, C28, C30, C31, C32, C36, C38, C39 | E8: C_0805_2012Metric | F8: Wurth Elektronik | G8: Mouser | H8: 710-885012207072 | I8: 0.069 | J8: of:=[.I8]*[.C8] -> 0.828
B9: 1uF | C9: 4 | D9: C33, C40, C48, C49 | E9: C_0805_2012Metric | F9: Wurth Elektronik | G9: Mouser | H9: 710-885012207078 | I9: 0.087 | J9: of:=[.I9]*[.C9] -> 0.348
A10: U | B10: 74AHC08 | C10: 2 | D10: U16,U14 | E10: SOIC-14_3.9x8.7mm_P1.27mm | F10: Texas Instruments | G10: Mouser | H10: 595-SN74AHC08QDRQ1 | I10: 0.402 | J10: of:=[.I10]*[.C10] -> 0.804
B11: 74AHC273 | C11: 9 | D11: U6, U24, U26, U27, U29, U31, U33, U35, U37 | E11: SSOP-20_5.3x7.2mm_P0.65mm | F11: Texas Instruments | G11: Mouser | H11: 595-SN74AHC273DBR | I11: 0.48 | J11: of:=[.I11]*[.C11] -> 4.32
B12: 74AHCT273 | C12: 1 | D12: U7 | E12: SOIC-20W_7.5x12.8mm_Pitch1.27mm | F12: Texas Instruments | G12: Mouser | H12: 595-SN74AHCT273DWR | I12: 0.489 | J12: of:=[.I12]*[.C12] -> 0.489
B13: 74LV163 | C13: 1 | D13: U8 | E13: SOIC-16_3.9x9.9mm_P1.27mm | F13: Texas Instruments | G13: Mouser | H13: 595-SN74LV163ADR | I13: 0.349 | J13: of:=[.I13]*[.C13] -> 0.349
B14: CD74AC238 | C14: 4 | D14: U9, U11, U13, U15 | E14: SOIC-16_3.9x9.9mm_P1.27mm | F14: Texas Instruments | G14: Mouser | H14: 595-CD74AC238M96 | I14: 0.591 | J14: of:=[.I14]*[.C14] -> 2.364
B15: 74AHCT244 | C15: 5 | D15: U19, U20, U21, U22, U23 | E15: SOIC-20W_7.5x12.8mm_Pitch1.27mm | F15: Texas Instruments | G15: Mouser | H15: 595-SN74AHCT244DWR | I15: 0.524 | J15: of:=[.I15]*[.C15] -> 2.62
B16: 74AHC138 | C16: 1 | D16: U17 | E16: SOIC-16W_5.3x10.2mm_P1.27mm | F16: Texas Instruments | G16: Mouser | H16: 595-SN74AHC138NSR | I16: 0.629 | J16: of:=[.I16]*[.C16] -> 0.629
B17: 74HC166 | C17: 1 | D17: U18 | E17: SOIC-16_3.9x9.9mm_P1.27mm | F17: Texas Instruments | G17: Mouser | H17: 595-SN74HC166DRE4 | I17: 0.794 | J17: of:=[.I17]*[.C17] -> 0.794
B18: 74LVC1G34 | C18: 1 | D18: U34 | E18: SOT-23-5 | F18: Texas Instruments | G18: Mouser | H18: 595-SN74LVC1G34DBVR | I18: 0.306 | J18: of:=[.I18]*[.C18] -> 0.306
B19: 74AHCT595 | C19: 1 | D19: U25 | E19: SOIC-16_3.9x9.9mm_P1.27mm | F19: Texas Instruments | G19: Mouser | H19: 595-SN74AHCT595DR | I19: 0.463 | J19: of:=[.I19]*[.C19] -> 0.463
B20: 74AHC05 | C20: 3 | D20: U1, U2, U5 | E20: SOIC-14_3.9x8.7mm_P1.27mm | F20: Texas Instruments | G20: Mouser | H20: 595-SN74AHC05D | I20: 0.96 | J20: of:=[.I20]*[.C20] -> 2.88
B21: 74AHC374 | C21: 1 | D21: U38 | E21: SOIC-20W_7.5x12.8mm_Pitch1.27mm | F21: Texas Instruments | G21: Mouser | H21: 595-SN74AHC374DWR | I21: 0.489 | J21: of:=[.I21]*[.C21] -> 0.489
B22: 74AHC1G04 | C22: 4 | D22: U10, U12, U36, U39 | E22: SOT-23-5 | F22: Texas Instruments | G22: Mouser | H22: 595-SN74AHC1G04DBVR | I22: 0.306 | J22: of:=[.I22]*[.C22] -> 1.224
B23: 74LVC1G157 | C23: 1 | D23: U4 | E23: SC-74-6_1.5x2.9mm_P0.95mm | F23: Nexperia | G23: Mouser | H23: 771-74LVC1G157GV-G | I23: 0.402 | J23: of:=[.I23]*[.C23] -> 0.402
B24: TPS7A0518PDBZR | C24: 1 | D24: U28 | E24: SOT-23-3 | F24: Texas Instruments | G24: Mouser | H24: 595-TPS7A0518PDBZR | I24: 0.471 | J24: of:=[.I24]*[.C24] -> 0.471
B25: SN74LVC8T245DW | C25: 1 | D25: U30 | E25: SSOP-24_5.3x8.2mm_P0.65mm | F25: Texas Instruments | G25: Mouser | H25: 595-74LVC8T245DBRG4 | I25: 1.39 | J25: of:=[.I25]*[.C25] -> 1.39
B26: SN74AVC4T245D | C26: 1 | D26: U32 | E26: SOIC-16_3.9x9.9mm_P1.27mm | F26: Texas Instruments | G26: Mouser | H26: 595-SN74AVC4T245D | I26: 1.34 | J26: of:=[.I26]*[.C26] -> 1.34
B27: XC2C256-VQ100 | C27: 1 | D27: IC1 | E27: VQFP-100_14x14mm_P0.5mm | F27: Xilinx Inc, | G27: Mouser | H27: 217-XC2C256-7VQG100C | I27: 42.84 | J27: of:=[.I27]*[.C27] -> 42.84
A28: R | B28: 470E | C28: 1 | D28: R5 | E28: R_0805_2012Metric | F28: Bourns | G28: Mouser | H28: 652-CR0805FX-4700ELF | I28: 0.087 | J28: of:=[.I28]*[.C28] -> 0.087
B29: 1k5 | C29: 1 | D29: R4 | E29: R_0805_2012Metric | F29: Bourns | G29: Mouser | H29: 652-CR0805FX-1501ELF | I29: 0.087 | J29: of:=[.I29]*[.C29] -> 0.087
B30: 1k | C30: 5 | D30: R1, R2, R3, R6, R7 | E30: R_0805_2012Metric | F30: Bourns | G30: Mouser | H30: 652-CR0805FX-1001ELF | I30: 0.087 | J30: of:=[.I30]*[.C30] -> 0.435
A31: RN | B31: 8x10k | C31: 2 | D31: RN1, RN2 | E31: R_Array_SIP9 | F31: Bourns | G31: Mouser | H31: 652-4609H-1LF-10K | I31: 0.646 | J31: of:=[.I31]*[.C31] -> 1.292
A32: D | B32: GREEN_2.65V_2mA | C32: 2 | D32: D1, D2 | E32: LED_1206_3216Metric | F32: Kingbright | G32: Mouser | H32: 604-APT3216LZGCK | I32: 0.437 | J32: of:=[.I32]*[.C32] -> 0.874
A33: J | B33: TE_Eurocard_96pole | C33: 1 | D33: J2 | E33: Eurocard_5650473-5 | F33: TE connectivity | G33: Mouser | H33: 571-5650473-5 | I33: 6 | J33: of:=[.I33]*[.C33] -> 6
B34: MM1_5530843-2 | C34: 1 | D34: J3 | E34: TE_5530843-2 | F34: TE connectivity | G34: Mouser | H34: 571-5530843-2 | I34: 2.91 | J34: of:=[.I34]*[.C34] -> 2.91
B35: ALU_JTAG | C35: 1 | D35: J1 | E35: PinHeader_1x06_P2.54mm_Vertical | F35: TE connectivity | G35: Mouser | H35: 571-826936-6 | I35: 0.454 | J35: of:=[.I35]*[.C35] -> 0.454
B36: UnusedPins_Connector | C36: 1 | D36: J4 | E36: PinHeader_2x15_P1.27mm_Vertical | F36: Samtec | G36: Mouser | H36: 200-TMS11501GD | I36: 5.31 | J36: of:=[.I36]*[.C36] -> 5.31
B37: ALU_PINS | C37: 1 | D37: J5 | E37: PinHeader_2x19_P1.27mm_Vertical | F37: Samtec | G37: Mouser | H37: 200-TMS12001GD | I37: 6.79 | J37: of:=[.I37]*[.C37] -> 6.79
A38: - | B38: PCB_GP8B | C38: - | D38: - | E38: - | F38: G.Guillet | G38: -
C39: of:=SUM([.C7:.C38]) -> 103
H40: Total price : | J40: of:=SUM([.J7:.J38]) -> 90.613
H41: *Depend of the quantity | I41: Price is in CHF